[
  {
    "id": "hello-orb",
    "title": "Hello Orb",
    "division": "studio-media",
    "route": "/labs/scenes/hello-orb",
    "visibility": "public_safe_demo",
    "data_mode": "synthetic",
    "approved_public": true,
    "entry_component": "components/scenes/hello-orb/index.tsx",
    "fallback_2d": "public/textures/hello-orb/fallback.png",
    "assets_dir": "public/textures/hello-orb",
    "asset_budget_mb": 1,
    "owner": "studio-media",
    "resource_limits": { "max_session_seconds": 120, "fps_floor": 20 },
    "passport": "components/scenes/hello-orb/passport.md",
    "created_at": "2026-10-01",
    "updated_at": "2026-10-01"
  },
  {
    "id": "spatial-proof-surface",
    "title": "Spatial Proof Surface",
    "division": "studio-media",
    "route": "/labs/scenes/spatial-proof-surface",
    "visibility": "public_safe_demo",
    "data_mode": "synthetic",
    "approved_public": true,
    "entry_component": "components/scenes/spatial-proof-surface/index.tsx",
    "fallback_2d": "public/textures/spatial-proof-surface/fallback.svg",
    "assets_dir": "public/textures/spatial-proof-surface",
    "asset_budget_mb": 1,
    "owner": "studio-media",
    "resource_limits": { "max_session_seconds": 120, "fps_floor": 20 },
    "passport": "components/scenes/spatial-proof-surface/passport.md",
    "created_at": "2026-10-02",
    "updated_at": "2026-10-02"
  },
  {
    "id": "botanical-garden",
    "title": "Botanical Garden",
    "division": "natural-systems",
    "route": "/labs/scenes/botanical-garden",
    "visibility": "public_safe_demo",
    "data_mode": "synthetic",
    "approved_public": true,
    "entry_component": "components/scenes/botanical-garden/index.tsx",
    "fallback_2d": "public/textures/botanical-garden/fallback.svg",
    "assets_dir": "public/textures/botanical-garden",
    "asset_budget_mb": 2,
    "owner": "natural-systems",
    "resource_limits": { "max_session_seconds": 180, "fps_floor": 20 },
    "passport": "components/scenes/botanical-garden/passport.md",
    "created_at": "2026-10-02",
    "updated_at": "2026-10-02"
  },
  {
    "id": "site-hero",
    "title": "Artemis System",
    "division": "core-platform",
    "route": "/",
    "visibility": "public_safe_demo",
    "data_mode": "synthetic",
    "approved_public": true,
    "entry_component": "components/scenes/site-hero/index.tsx",
    "fallback_2d": "public/textures/site-hero/fallback.svg",
    "assets_dir": "public/textures/site-hero",
    "asset_budget_mb": 1,
    "owner": "core-platform",
    "resource_limits": { "max_session_seconds": 30, "fps_floor": 24 },
    "passport": "components/scenes/site-hero/passport.md",
    "created_at": "2026-10-02",
    "updated_at": "2026-10-02"
  },
  {
    "id": "evolution-architecture-map",
    "title": "Evolution Architecture Map",
    "division": "core-platform",
    "route": "/labs/scenes/evolution-architecture-map",
    "visibility": "internal_operations",
    "data_mode": "mixed_explicit",
    "approved_public": false,
    "entry_component": "components/scenes/evolution-architecture-map/index.tsx",
    "fallback_2d": "public/textures/evolution-architecture-map/fallback.svg",
    "assets_dir": "public/textures/evolution-architecture-map",
    "asset_budget_mb": 1,
    "owner": "core-platform",
    "resource_limits": { "max_session_seconds": 120, "fps_floor": 20 },
    "passport": "components/scenes/evolution-architecture-map/passport.md",
    "created_at": "2026-10-03",
    "updated_at": "2026-10-03"
  },
  {
    "id": "gaussian-surface",
    "title": "Gaussian Surface",
    "type": "3d",
    "division": "core-platform",
    "route": "/labs/scenes/gaussian-surface",
    "visibility": "public_safe_demo",
    "data_mode": "synthetic",
    "approved_public": true,
    "entry_component": "components/scenes/gaussian-surface/index.tsx",
    "fallback_2d": "public/textures/gaussian-surface/fallback.svg",
    "assets_dir": "public/textures/gaussian-surface",
    "asset_budget_mb": 1,
    "owner": "core-platform",
    "resource_limits": { "max_session_seconds": 120, "fps_floor": 20 },
    "passport": "components/scenes/gaussian-surface/passport.md",
    "created_at": "2026-10-04",
    "updated_at": "2026-10-04"
  }
]
